Id;SubId;Name (click to view profile);Date;Likes;Comment;Link
1;;A the music person;22.11.18 10:35:24;0;"""SOON WE'LL TELEVISE OUR C-O-L-O-R,  NOW LEAVE ME BLINDED AND ERASE MY MEMORIES""- Kennith";https://www.youtube.com/watch?v=i5qOzqD9Rms&lc=Ugxuvhqku_beqgGb_x54AaABAg
2;;A. Z.;22.11.18 10:35:24;5;I need incredibles 3 !!!!!! This was the best movie ever?? enjoyed it soooo much ??????;https://www.youtube.com/watch?v=i5qOzqD9Rms&lc=UgztTezVeaHUWQFRm7t4AaABAg
;2-1;Rijae Pearson;22.09.19 10:35:24;0;A. Z.   N.  N;https://www.youtube.com/watch?v=i5qOzqD9Rms&lc=UgztTezVeaHUWQFRm7t4AaABAg
3;;Abdul Majied;22.11.18 10:35:24;1;Violet is so annoying with his bf issue. I want more dash moment. Dash look like a boy that my mom babysit, accept dash had a blonde hair.;https://www.youtube.com/watch?v=i5qOzqD9Rms&lc=UgwDWpPQFgV4kCUhDlB4AaABAg
4;;Ada Apa;22.11.18 10:35:24;0;Suka banget sama film disney semua orang indonesia juga pasti suka terutama mickey mouse tapi kenapa disneyland ga ada di indonesiaya;https://www.youtube.com/watch?v=i5qOzqD9Rms&lc=UgwBMN9iqVoPVFKEOSp4AaABAg
5;;Ag Jr;22.11.18 10:35:24;0;"What some people know: This movie was originally supposed to come out next year. What more people don't know: The reason it was moved to this year was because they switched its release date with that of Toy Story 4.";https://www.youtube.com/watch?v=i5qOzqD9Rms&lc=Ugyza0jV63inlOYi3mN4AaABAg
6;;Aisla Studios;22.11.18 10:35:24;0;I've seen that a lot of people have been like (not aiming towards everyone) '' Jesus this took AGES,''  they probably started making this WHEN THE FIRST MOVIE WAS MADE these things take TIME! If they released it after the first film it would have been absolute TRASH.;https://www.youtube.com/watch?v=i5qOzqD9Rms&lc=Ugxr2Qb5iUSPqvj12m14AaABAg
7;;Aleena Malik;22.11.18 10:35:24;4;I watched it last month! It was AWESOME;https://www.youtube.com/watch?v=i5qOzqD9Rms&lc=UgzjAGw-CbfM4m9ZEWZ4AaABAg
8;;Alexa Ivanca;22.11.18 10:35:24;0;I Like it;https://www.youtube.com/watch?v=i5qOzqD9Rms&lc=UgzCXhqii9jM5QGOgbJ4AaABAg
9;;Alexa Linares;22.11.18 10:35:24;1;I don't know if it's me but... Has anyone notice Edna looks exactly like Hetty Lange ??????they are literally almost like twins in my opinion??;https://www.youtube.com/watch?v=i5qOzqD9Rms&lc=UgzZ4Ar2NlPe7Tv3SrV4AaABAg
10;;Amber and Derek O;22.11.18 10:35:24;1;Worth the wait:);https://www.youtube.com/watch?v=i5qOzqD9Rms&lc=UgxazLjev8KGgghWz4l4AaABAg
11;;Ambitious Muscle;22.11.18 10:35:24;0;Crazy how far animation has come in the last 10 odd years it looks so much better with the lighting, effects, models and animation.;https://www.youtube.com/watch?v=i5qOzqD9Rms&lc=Ugx8ESELagPPycGrn4N4AaABAg
12;;Amir Hossen;22.11.18 10:35:24;0;????????????;https://www.youtube.com/watch?v=i5qOzqD9Rms&lc=UgxIielVgwlQSuwchEF4AaABAg
13;;Angel Claudio;22.11.18 10:35:24;0;BRUH THEY NEVER CAUGHT THE UNDERMINER(1st villain) HE GOT AWAY WITH ALL THAT MONEY;https://www.youtube.com/watch?v=i5qOzqD9Rms&lc=UgwzCYIPGWZ9LThOgCx4AaABAg
14;;Anon ymous;22.11.18 10:35:24;0;"Went and saw the movie today. Unfortunately my hunch was right about it not being as good as the first but i never properly judge a film on the first watch espeiclaly when seen at the cinema. It takes me a few more times to watch it prefrably in the comfort of my own home to fully appreciate/understand the film.  The first film was groundbreaking in both visuals and stroy. One of Pixars finest for sure. Came out of knowhere. Not dissapointing but the fact i fell asleep severla times says it all really. Anyone ever get the cinema to yourself btw? Why is it so hard for me to find an empty screen room? Am i not going often enough? I thought yesterday was the day as i was all alone up until one black guy came and sat in. TBh wasn;t as big of a deal having it to myself more of  anovelty would have been nice htough. Not having to worry about making noise, sitting wher ei want and have more freedom. Choosing which seat i wnated to sit in for th ebest view was great also.";https://www.youtube.com/watch?v=i5qOzqD9Rms&lc=Ugy728j92eY_ZN870U94AaABAg
;14-1;viscabvrca;22.11.18 10:35:24;0;Anon ymous i fell asleep aswell;https://www.youtube.com/watch?v=i5qOzqD9Rms&lc=Ugy728j92eY_ZN870U94AaABAg
15;;Antonio Borja;22.11.18 10:35:24;0;You take;https://www.youtube.com/watch?v=i5qOzqD9Rms&lc=UgwUxaz876aHPBau0Xx4AaABAg
16;;Arda Aytekin;22.11.18 10:35:24;0;That was “i n c r e d i b l e”;https://www.youtube.com/watch?v=i5qOzqD9Rms&lc=Ugxxjiw8DxbC6f23-U94AaABAg
17;;Aris Romadhon;22.11.18 10:35:24;1;Aw jack-jack is so cute ????????????;https://www.youtube.com/watch?v=i5qOzqD9Rms&lc=UgwQ5lLwWuNqWmBKW9V4AaABAg
18;;Armando Sanchez;22.11.18 10:35:24;0;Public fire drill;https://www.youtube.com/watch?v=i5qOzqD9Rms&lc=UgwIzhkteb9CqtXsCud4AaABAg
19;;Armando Sanchez;22.11.18 10:35:24;0;Publix;https://www.youtube.com/watch?v=i5qOzqD9Rms&lc=UgzKIY1xLV-mv2bh9RB4AaABAg
20;;B J;22.11.18 10:35:24;1;???? =??????;https://www.youtube.com/watch?v=i5qOzqD9Rms&lc=Ugz5s3YR084qQRr6sal4AaABAg
21;;BUP;22.11.18 10:35:24;0;I could not stop replaying this when it came out.;https://www.youtube.com/watch?v=i5qOzqD9Rms&lc=UgxIZXIZRSlJLRnJkEJ4AaABAg
22;;Baron TMM;22.11.18 10:35:24;1;See you guys in 2032.;https://www.youtube.com/watch?v=i5qOzqD9Rms&lc=UgyI5gzAfAJ6n_XbjA54AaABAg
23;;Ben Munn;22.11.18 10:35:24;1;"2004: ""Where is my super suit"" 2018: Frozone: I'll be there ASAP (Grabs his super suit) Frozone's wife: Where you going ASAP you better be back ASAP";https://www.youtube.com/watch?v=i5qOzqD9Rms&lc=UgwzcLg--wSbioWg7Ud4AaABAg
24;;BlackLister;22.11.18 10:35:24;0;200 mil to make this kid's movie.. how????!!!!!;https://www.youtube.com/watch?v=i5qOzqD9Rms&lc=UgzmyKQugneGUZyMc694AaABAg
25;;Bleron Mehmeti;22.11.18 10:35:24;0;that movie is really funny;https://www.youtube.com/watch?v=i5qOzqD9Rms&lc=UgxZkGM9k2EQB4sT7ol4AaABAg
26;;Bts Bigbang got 7;22.11.18 10:35:24;1;I remember watching this when I was in second grade;https://www.youtube.com/watch?v=i5qOzqD9Rms&lc=UgwUHgDcWBPqPUHfkEp4AaABAg
27;;Bullseye Og;22.11.18 10:35:24;2;It’s prolly gonna take another 14 years to make the 3 one;https://www.youtube.com/watch?v=i5qOzqD9Rms&lc=Ugy4vulM5E4DUJsMbwV4AaABAg
;27-1;MeikaPuu;22.11.18 10:35:24;0;Clarence Hudson fr;https://www.youtube.com/watch?v=i5qOzqD9Rms&lc=Ugy4vulM5E4DUJsMbwV4AaABAg
28;;C King;22.11.18 10:35:24;0;More of them and cars!;https://www.youtube.com/watch?v=i5qOzqD9Rms&lc=UgxtTHMuRJzvVawlZiV4AaABAg
29;;CARTOONS PLANET;22.11.18 10:35:24;0;I love Disney Pixar and walt;https://www.youtube.com/watch?v=i5qOzqD9Rms&lc=UgzA82reOsfNQTRE2Jp4AaABAg
30;;Captain Jakemerica;22.11.18 10:35:24;1;1:08  me when I do my math homework;https://www.youtube.com/watch?v=i5qOzqD9Rms&lc=UgwAy3VPFB_iciBRUwB4AaABAg
31;;Cartier Naruto;22.11.18 10:35:24;0;When do we get to see frozone Wife??;https://www.youtube.com/watch?v=i5qOzqD9Rms&lc=Ugwb07h_WYS6CXbcDGV4AaABAg
32;;Chancelle Florence Nzang Ngomo;22.11.18 10:35:24;1;Just watched it, so much action  ! I loved it, i laughed a lot and the fight scenes are just amazing.;https://www.youtube.com/watch?v=i5qOzqD9Rms&lc=UgzLgsW5xZ2apDONS_R4AaABAg
33;;Chrysaura;22.11.18 10:35:24;0;Frozone's wife is still my fave character XD;https://www.youtube.com/watch?v=i5qOzqD9Rms&lc=UgwvdLsAhyN-s4jg4jt4AaABAg
34;;Cira Björklund;22.11.18 10:35:24;0;OMG;https://www.youtube.com/watch?v=i5qOzqD9Rms&lc=UgzlgiQGu8ijJqmIPZF4AaABAg
35;;Cole Norton;22.11.18 10:35:24;0;Who else likes bobs scream;https://www.youtube.com/watch?v=i5qOzqD9Rms&lc=UgyXrE6q3sAHbFfereR4AaABAg
36;;Cool guy;22.11.18 10:35:24;1;W H E R E I S M Y S U P E R S U I T?;https://www.youtube.com/watch?v=i5qOzqD9Rms&lc=UgwLorTzvFzf5LPzOvN4AaABAg
37;;Danthepaperman6/ClassicalCabc;22.11.18 10:35:24;0;It says releases in June 15th only to re release in labor day in some movie theater locations.;https://www.youtube.com/watch?v=i5qOzqD9Rms&lc=Ugxru36-I7IiZfrZXJJ4AaABAg
38;;Dennis C;22.11.18 10:35:24;1;The trailer doesn’t do the movie any justice, by design on purpose.  The plot was amazing, and the humor in between was brilliant.  Good job team Pixar!;https://www.youtube.com/watch?v=i5qOzqD9Rms&lc=Ugy-icY40XJeF8GY0Q54AaABAg
39;;Dinesh Manchukonda;22.11.18 10:35:24;0;I want jack jack stand alone film;https://www.youtube.com/watch?v=i5qOzqD9Rms&lc=UgzG6zsZYILwMTDsUal4AaABAg
40;;Diogo;22.11.18 10:35:24;0;I still can't believe I haven't watched this yet!! Ahhhh;https://www.youtube.com/watch?v=i5qOzqD9Rms&lc=UgwXLx0kDqt9zxkUVh94AaABAg
41;;Dominika Drago;22.11.18 10:35:24;0;4:00  -  4:14  ??;https://www.youtube.com/watch?v=i5qOzqD9Rms&lc=UgzJyvUUQQwzb5b6oJp4AaABAg
42;;Dr. Shamsun Nahar Shumi;22.11.18 10:35:24;0;Please make toy story 4 please it is very will be very interesting peal make it toy story is very very interesting. Please don't end it up. I want to see the next age or next generation.pls,pls,pls,pls,pls,pls,pls,pls,Please Please Please Please Please Please Please Please Please Please Please Please Please Please Please.I would very very very happy;https://www.youtube.com/watch?v=i5qOzqD9Rms&lc=Ugx916g_UxAiQVqDEkt4AaABAg
;42-1;geboinzki .Iman28;22.11.18 10:35:24;0;Don't Worry Toy Story 4 will be next year;https://www.youtube.com/watch?v=i5qOzqD9Rms&lc=Ugx916g_UxAiQVqDEkt4AaABAg
43;;Edward Cullen;22.11.18 10:35:24;0;Is there going to have incredibles 3??? Pls tell me;https://www.youtube.com/watch?v=i5qOzqD9Rms&lc=Ugy2m3YuWLbeNiRCj8h4AaABAg
44;;EeveeStar 682;22.11.18 10:35:24;1;GUYS THIS FILM HAS ALMOST MADE MORE MONEY THAN FROZEN AND IT'S STILL IN CINEMA;https://www.youtube.com/watch?v=i5qOzqD9Rms&lc=UgxfkEJ1CELMD-OjyQ94AaABAg
45;;Einstein II;22.11.18 10:35:24;0;The Jewish are destroying humanity;https://www.youtube.com/watch?v=i5qOzqD9Rms&lc=UgydT4RGckdXld9ESXB4AaABAg
46;;Emerson Sanders;22.11.18 10:35:24;0;I'm so happy I watched this great movie. I remember wayback in 2004 I got a toy from them in my cereal . It's been 14 years it's kinda makes me feel... I don't know how to say it, it just makes me very happy . Love the Incredibles 2;https://www.youtube.com/watch?v=i5qOzqD9Rms&lc=Ugydt04A1Ry5G0Y7jbp4AaABAg
47;;Emilio Sanchez;22.11.18 10:35:24;0;It will be on October 22 2018!!!!!!!!!!!!!!!!!!!!!  ?????????????????????????????????? YAY!!!!  2 days until incredible  Comes out!;https://www.youtube.com/watch?v=i5qOzqD9Rms&lc=UgyLfQGg114rULCfKPp4AaABAg
48;;Enes;22.11.18 10:35:24;1208;"“Where you going ASAP?” “You better be back ASAP” Once a legend, always a legend";https://www.youtube.com/watch?v=i5qOzqD9Rms&lc=UgxX-ESu3EE_zd9pZ2Z4AaABAg
;48-1;Space Nerd;22.11.18 10:35:24;3;Lol;https://www.youtube.com/watch?v=i5qOzqD9Rms&lc=UgxX-ESu3EE_zd9pZ2Z4AaABAg
;48-2;dwimantoarif;22.11.18 10:35:24;2;Bleach;https://www.youtube.com/watch?v=i5qOzqD9Rms&lc=UgxX-ESu3EE_zd9pZ2Z4AaABAg
;48-3;Dre R;22.11.18 10:35:24;6;That part wasn’t even in the movie... or did I miss it?;https://www.youtube.com/watch?v=i5qOzqD9Rms&lc=UgxX-ESu3EE_zd9pZ2Z4AaABAg
;48-4;Batman The dark knight;22.11.24 15:45:47;0;He better freezestyle ASAP;https://www.youtube.com/watch?v=i5qOzqD9Rms&lc=UgxX-ESu3EE_zd9pZ2Z4AaABAg
;48-5;Zander;22.01.19 10:35:24;9;@Dre R  You missed it.;https://www.youtube.com/watch?v=i5qOzqD9Rms&lc=UgxX-ESu3EE_zd9pZ2Z4AaABAg
;48-6;Angel Yadiel Davila;###############################################################################################################################################################################################################################################################;0;"Planeta Disney  Pronto";https://www.youtube.com/watch?v=i5qOzqD9Rms&lc=UgxX-ESu3EE_zd9pZ2Z4AaABAg
;48-7;Avdullah HOTI;22.06.19 10:35:24;0;@Dre R  it wasn`t your right;https://www.youtube.com/watch?v=i5qOzqD9Rms&lc=UgxX-ESu3EE_zd9pZ2Z4AaABAg
;48-8;Keros Kreation;22.09.19 10:35:24;0;1000nd like baby yeet.;https://www.youtube.com/watch?v=i5qOzqD9Rms&lc=UgxX-ESu3EE_zd9pZ2Z4AaABAg
49;;Envious_Soul;22.11.18 10:35:24;0;Math Is Math;https://www.youtube.com/watch?v=i5qOzqD9Rms&lc=Ugxu2XuVrsGRwueBDy94AaABAg
50;;Epic Movie Compilations;22.11.18 10:35:24;0;I hate it when Pixar make a sequel and yet, no third film. A trilogy consists of a beginning, middle and an end. Incredibles 2 should never have happened. Toy Story 4 seems fitting since there actually is more to explore. Hell, people thought Toy Story 3 was a bad idea.;https://www.youtube.com/watch?v=i5qOzqD9Rms&lc=Ugzc7ozFFYjQHRAXksZ4AaABAg
51;;Et Immortalem;22.11.18 10:35:24;0;The little kid is over powered;https://www.youtube.com/watch?v=i5qOzqD9Rms&lc=UgzbYJQyaSaAWiyXD8V4AaABAg
52;;Eva Dobre;22.11.18 10:35:24;0;Hei ! Can  you please make a “Warriors cats” movie ? I really like “Warriors cats” and I would like to see a movie about this ! You can read the books, for ideas and please make it 12+ because it contains blood and death .... Tell me if you like my idea !;https://www.youtube.com/watch?v=i5qOzqD9Rms&lc=Ugz0xtMG_vm5gIoOyfl4AaABAg
53;;F dL;22.11.18 10:35:24;0;I don't have seizures but I can see why one of the fight scenes could cause one. ??;https://www.youtube.com/watch?v=i5qOzqD9Rms&lc=Ugwj3_ZVWodCYgTv7Sx4AaABAg
54;;FAT POTATO FATTIE;22.11.18 10:35:24;0;Hi guys I’m dressed as violet;https://www.youtube.com/watch?v=i5qOzqD9Rms&lc=UgwoSnDApfbROWIuNzx4AaABAg
55;;Farhan Khan;22.11.18 10:35:24;0;Why mrs incrible is talking to table;https://www.youtube.com/watch?v=i5qOzqD9Rms&lc=UgztoQkn7lRTMfGec1t4AaABAg
56;;Faze Al dusty;22.11.18 10:35:24;0;0:13  that expropriation do;https://www.youtube.com/watch?v=i5qOzqD9Rms&lc=Ugyu2Th6M63fMgjCkRh4AaABAg
57;;FeniX_The1;22.11.18 10:35:24;1;Wall-E 2 Coming? :P;https://www.youtube.com/watch?v=i5qOzqD9Rms&lc=Ugxnf3gbw81_40JIjW94AaABAg
58;;Fenly Papendang;22.11.18 10:35:24;0;Samuel L. Jackson must freezed Thanos with superpower.;https://www.youtube.com/watch?v=i5qOzqD9Rms&lc=UgypHMJV7I4hZClmvGp4AaABAg
59;;Fortnite master;22.11.18 10:35:24;1;great movie;https://www.youtube.com/watch?v=i5qOzqD9Rms&lc=Ugwl4gajkMxOzSnwxw94AaABAg
60;;Francisca Geneke;22.11.18 10:35:24;0;I watched this movie;https://www.youtube.com/watch?v=i5qOzqD9Rms&lc=UgzeLaNFcvqWQaltOYl4AaABAg
61;;Fun Mahomies;22.11.18 10:35:24;0;?????? NO it won't;https://www.youtube.com/watch?v=i5qOzqD9Rms&lc=UgyuJMSFuGlc2p87p894AaABAg
62;;GIRLS & BOYS 7;22.11.18 10:35:24;1;I want you make film incredibles 3;https://www.youtube.com/watch?v=i5qOzqD9Rms&lc=Ugxg9JxOJO_EDiO1-XR4AaABAg
63;;Gauss24;22.11.18 10:35:24;0;saw it this morning, loved it. the first one is still more amazng though. jack jack was the best part of this one;https://www.youtube.com/watch?v=i5qOzqD9Rms&lc=UgwQnC-o_1HaNRYw5mJ4AaABAg
64;;Gowtham;22.11.18 10:35:24;0;Feminism started taking place on animated movies also. its a virus!;https://www.youtube.com/watch?v=i5qOzqD9Rms&lc=UgzKIEEoNcUXtMwK9j94AaABAg
65;;Grace Woofter;22.11.18 10:35:24;0;MATH IS MATH;https://www.youtube.com/watch?v=i5qOzqD9Rms&lc=Ugy7hIX_qSe6fiKPMEZ4AaABAg
66;;Harsh Joshi;22.11.18 10:35:24;0;Lovely movie it is..????????????????????;https://www.youtube.com/watch?v=i5qOzqD9Rms&lc=Ugw36vkqrMrX0jm6y4l4AaABAg
67;;Haso Gho;22.11.18 10:35:24;0;Fab movie!;https://www.youtube.com/watch?v=i5qOzqD9Rms&lc=Ugz63JqDZS5hSazcNGN4AaABAg
68;;Hello it’s me;22.11.18 10:35:24;1;Math is Math;https://www.youtube.com/watch?v=i5qOzqD9Rms&lc=UgxJPi5MHG788UlBr354AaABAg
69;;Holly S;22.11.18 10:35:24;0;Violet is so cool with her powers! I want incredible 3!!!!;https://www.youtube.com/watch?v=i5qOzqD9Rms&lc=UgxWgqr2jdhmz8wTA8N4AaABAg
70;;JADE Lp;22.11.18 10:35:24;0;Super and cool;https://www.youtube.com/watch?v=i5qOzqD9Rms&lc=UgwDCdnuLaLy8Fft3cx4AaABAg
71;;Jackier Abaday;22.11.18 10:35:24;0;trailer much better than the movie Its kinda boring;https://www.youtube.com/watch?v=i5qOzqD9Rms&lc=UgzNxwePfGoJtqtOvE94AaABAg
72;;Jacqueline Morano;22.11.18 10:35:24;0;"2:02  - An interesting fun fact, but a spoiler alert: The actress, Catherine Keener, who voiced and played Evelyn Deavor, who’s alter ego is ScreenSlaver used hypnotism in The Incredibles 2. While in another film, Get Out, Catherine Keener plays Missy Armitage, whose character also used hypnotism!";https://www.youtube.com/watch?v=i5qOzqD9Rms&lc=UgyfifTKJjW3PP0CnQJ4AaABAg
73;;James Nicholls;22.11.18 10:35:24;0;I was a little disappointed they didn't at least have a Syndrome cameo.;https://www.youtube.com/watch?v=i5qOzqD9Rms&lc=UgyH51a9vlgcGSOHDhB4AaABAg
74;;Jess;22.11.18 10:35:24;0;Nice;https://www.youtube.com/watch?v=i5qOzqD9Rms&lc=UgzFjSp2NNn6QdGuN2x4AaABAg
75;;Jesse Skyn;22.11.18 10:35:24;0;WANN KOMMT ER ????????;https://www.youtube.com/watch?v=i5qOzqD9Rms&lc=UgznEXr3Q5lFTxsgtRh4AaABAg
76;;Jinn 8612;22.11.18 10:35:24;0;Amazing Progress.;https://www.youtube.com/watch?v=i5qOzqD9Rms&lc=UgyX_5gKMcg4X4Pk8Mp4AaABAg
77;;Joker AOV;22.11.18 10:35:24;1;Baby is The Power.;https://www.youtube.com/watch?v=i5qOzqD9Rms&lc=UgyVYE00Gg_byp1ilK14AaABAg
78;;Joseph Benson;22.11.18 10:35:24;0;I just saw the movie and I have a question. if the villains hypnotizing goggles rely on somebody watching them in order to work. why don't the heroes just close their eyes right before the villains put the goggles on them? I know once they're hypnotized they have no real choice but there's nothing stopping the heroes from just closing their eyes right before the goggles get put on them, pretend like you're hypnotized until they get a chance to rip them off.;https://www.youtube.com/watch?v=i5qOzqD9Rms&lc=UgxPBdobQliYePYcWxl4AaABAg
79;;Joshua Gore;22.11.18 10:35:24;1;"Violet: Did you wash your hands? Dash: Speeds off and come back Violet: with, SOAP? Dash: Squish and comes back Violet: Did you dry them?  Dash: shakes hands hard like bird flapping wings";https://www.youtube.com/watch?v=i5qOzqD9Rms&lc=Ugwur3DCR1aji7o1QQd4AaABAg
80;;Justice Girl;22.11.18 10:35:24;5;IT WAS A 10/10 I LOVED THE MOVIEEEE YOU SHOULD GO SEE IT,;https://www.youtube.com/watch?v=i5qOzqD9Rms&lc=UgwDL1N6EwqyXVu8Brt4AaABAg
81;;K M;22.11.18 10:35:24;1;Great film despite waiting a long time for it to come out. Better than the first one.;https://www.youtube.com/watch?v=i5qOzqD9Rms&lc=UgwlE-t8O1ze2Zn3HEd4AaABAg
82;;Kaushik Shettigar;22.11.18 10:35:24;0;I have the complete movie, if anyone wants.;https://www.youtube.com/watch?v=i5qOzqD9Rms&lc=Ugyo2d7XG82O5Rcs1eZ4AaABAg
83;;Kenyon Scott;22.11.18 10:35:24;0;"They forgot ""The"" in the logo, it pronounced ""The Incredibles 2""";https://www.youtube.com/watch?v=i5qOzqD9Rms&lc=UgxeCwbavezrcqyMv2t4AaABAg
84;;Kika Park;22.11.18 10:35:24;0;Even better than first movie;https://www.youtube.com/watch?v=i5qOzqD9Rms&lc=UgxaY4-SBSgvEqCuKvd4AaABAg
85;;KoFx ChAozZ;22.11.18 10:35:24;197;Who just came here after watching the actual movie ??????;https://www.youtube.com/watch?v=i5qOzqD9Rms&lc=UgzEOprD9GXCDnGQYMV4AaABAg
;85-1;Quickshot Plays;22.11.18 10:35:24;0;Me;https://www.youtube.com/watch?v=i5qOzqD9Rms&lc=UgzEOprD9GXCDnGQYMV4AaABAg
;85-2;Quickshot Plays;22.11.18 10:35:24;0;thanks to googl ply;https://www.youtube.com/watch?v=i5qOzqD9Rms&lc=UgzEOprD9GXCDnGQYMV4AaABAg
;85-3;shilpi mukherjee;22.11.24 15:45:47;0;watched in google play me;https://www.youtube.com/watch?v=i5qOzqD9Rms&lc=UgzEOprD9GXCDnGQYMV4AaABAg
;85-4;Stay Lowkey;22.03.19 10:35:24;0;Me;https://www.youtube.com/watch?v=i5qOzqD9Rms&lc=UgzEOprD9GXCDnGQYMV4AaABAg
;85-5;The trash can;22.04.19 10:35:24;0;MEEE;https://www.youtube.com/watch?v=i5qOzqD9Rms&lc=UgzEOprD9GXCDnGQYMV4AaABAg
;85-6;MUSTAFA AHMED;22.10.19 10:35:24;0;what is so funny about this why did you put the laughing emojis?;https://www.youtube.com/watch?v=i5qOzqD9Rms&lc=UgzEOprD9GXCDnGQYMV4AaABAg
86;;KroeKlaw;22.11.18 10:35:24;0;"""TOO LATE! 15 years, too late...""";https://www.youtube.com/watch?v=i5qOzqD9Rms&lc=UgyPZvGu7TG10SKp9YF4AaABAg
87;;Lavender Animates;22.11.18 10:35:24;3;WHY DO THEY CHANGE MATH?!;https://www.youtube.com/watch?v=i5qOzqD9Rms&lc=UgzU7dfTv8EQiThIKxd4AaABAg
88;;Leo Donald;22.11.18 10:35:24;0;Saw this today. Awesome job;https://www.youtube.com/watch?v=i5qOzqD9Rms&lc=UgzVH-1rsP6Z8RyOjB94AaABAg
89;;Leonardo Carbone;22.11.18 10:35:24;0;ZZ;https://www.youtube.com/watch?v=i5qOzqD9Rms&lc=UgybCYcvbXqBqRVd4yB4AaABAg
90;;Lizzy Gacha_Life;22.11.18 10:35:24;0;"Did you wash your hands? With soap?  Did you dry them? What is this all vegetables!!!";https://www.youtube.com/watch?v=i5qOzqD9Rms&lc=UgwwfLPsJnddfnRjVXJ4AaABAg
91;;Lord Turki;22.11.18 10:35:24;0;is trailer is absolute amazing, 10/10;https://www.youtube.com/watch?v=i5qOzqD9Rms&lc=UgyUj2WBWV_r5Oqo-W54AaABAg
92;;Lu2kool4U;22.11.18 10:35:24;3;0:04  Violet: Did you wash your hands? Dash: Did YOU?!.!;https://www.youtube.com/watch?v=i5qOzqD9Rms&lc=UgxRVkYkAm1cV8lUxXJ4AaABAg
93;;M;22.11.18 10:35:24;1;Worst voices choice ever!;https://www.youtube.com/watch?v=i5qOzqD9Rms&lc=UgwJ-GrukVk1qkht7qp4AaABAg
94;;MGstaR17;22.11.18 10:35:24;0;Elasticgirl 4ever;https://www.youtube.com/watch?v=i5qOzqD9Rms&lc=UgyDLCdlFkBalafgfa14AaABAg
95;;MR MONEY BAG 666;22.11.18 10:35:24;0;????????;https://www.youtube.com/watch?v=i5qOzqD9Rms&lc=UgyWKmkWVoQ9uII8RL14AaABAg
96;;Maharajasala;22.11.18 10:35:24;1;This movie sucked big tim compared to part one;https://www.youtube.com/watch?v=i5qOzqD9Rms&lc=UgxLmqs90jYfy6CVO_R4AaABAg
97;;Malik Gunebakan;22.11.18 10:35:24;0;Soooooo..... when’s the third movie coming out? Or we gotta wait another decade for that one?;https://www.youtube.com/watch?v=i5qOzqD9Rms&lc=Ugw5jKLaUzflQPLjrZB4AaABAg
98;;Maris Atra Septia;22.11.18 10:35:24;0;Aahh w bener² suka sm kartun iniiii ??;https://www.youtube.com/watch?v=i5qOzqD9Rms&lc=UgyRH8gBUp2vxlJlXQ54AaABAg
99;;Maris Atra Septia;22.11.18 10:35:24;0;Yg di tunggu² keluar jg ??;https://www.youtube.com/watch?v=i5qOzqD9Rms&lc=UgxKnDMq0Ypdgzt8qJ94AaABAg
100;;Maris Atra Septia;22.11.18 10:35:24;0;????????;https://www.youtube.com/watch?v=i5qOzqD9Rms&lc=Ugzu0xjRz85t9pMGqap4AaABAg
101;;Martin Kojac;22.11.18 10:35:24;0;Take my money ??????;https://www.youtube.com/watch?v=i5qOzqD9Rms&lc=UgwUVUNKNuVT9kclbKJ4AaABAg
102;;Meat Claw;22.11.18 10:35:24;0;5/10. Stock story by the end. No syndrome esq baddies;https://www.youtube.com/watch?v=i5qOzqD9Rms&lc=UgwQlrZ7ljK9S1Nimg94AaABAg
103;;Miss Anonymous;22.11.18 10:35:24;0;Hahaha I love this villains Hypnosis in reality maybe all president on nuclear then war begin.;https://www.youtube.com/watch?v=i5qOzqD9Rms&lc=UgzHTXlpCJKCNdjB5vd4AaABAg
104;;Miss Anonymous;22.11.18 10:35:24;0;Mean in reality this world have super hero but them hidden some where because politics hate them they know if super hero help people mean we not need more police or another government more...;https://www.youtube.com/watch?v=i5qOzqD9Rms&lc=Ugxi_BQIcQjcsUCSALd4AaABAg
105;;Miss Nina 's;22.11.18 10:35:24;3;waited so long for this ! and it is good really , really good for a family hero movie! this is a sequel master piece ! and i dont normaly like sequels! i would take my hat off and bow to Brad Bird about the incredibles  2 story!;https://www.youtube.com/watch?v=i5qOzqD9Rms&lc=UgyySl4TDsxoRxYCsIV4AaABAg
106;;Morito Cabron;22.11.18 10:35:24;0;very disappointing film;https://www.youtube.com/watch?v=i5qOzqD9Rms&lc=UgwG3zriK65o1W9Ma0J4AaABAg
107;;Mr. NoName;22.11.18 10:35:24;0;jack jack amazing :);https://www.youtube.com/watch?v=i5qOzqD9Rms&lc=UgymMJeSZrWIqJ7STyV4AaABAg
108;;MrGabeanator;22.11.18 10:35:24;0;finnmonster sent me;https://www.youtube.com/watch?v=i5qOzqD9Rms&lc=Ugz0jaO8HV8mcNwgZ1h4AaABAg
109;;MrGabeanator;22.11.18 10:35:24;0;the bluray is already on my Christmas list anyone else?;https://www.youtube.com/watch?v=i5qOzqD9Rms&lc=UgyMWC-5pyAa8dqneLZ4AaABAg
110;;MrViMichael;22.11.18 10:35:24;0;Im already over 20 years old, but I still stuck in my Childhood because Disney wants to...;https://www.youtube.com/watch?v=i5qOzqD9Rms&lc=UgxB03hQ0xIMGowX1AZ4AaABAg
111;;Mrko280 Hi;22.11.18 10:35:24;0;This is now a tik tok now;https://www.youtube.com/watch?v=i5qOzqD9Rms&lc=UgxQSKb0ao7SHeUZQDp4AaABAg
112;;Muneeba's guild;22.11.18 10:35:24;0;The female voice character for mom the stretchy incredible is like an old lady voice and doesn't suite the character mom it suites for a grandma...so wrong choice they made;https://www.youtube.com/watch?v=i5qOzqD9Rms&lc=UgyYzspxPF5_N8YqxWN4AaABAg
113;;Mustofa Zaenuddin;22.11.18 10:35:24;1;salut;https://www.youtube.com/watch?v=i5qOzqD9Rms&lc=UgyeHRgmNgECYg_58i54AaABAg
114;;My name is Connor;22.11.18 10:35:24;0;INCREADABLES 2 WAS LIT ??????????;https://www.youtube.com/watch?v=i5qOzqD9Rms&lc=UgzqBR9np16qdD_JVHF4AaABAg
115;;N. G;22.11.18 10:35:24;0;Lit film;https://www.youtube.com/watch?v=i5qOzqD9Rms&lc=Ugxej1K56QHan4O_YIp4AaABAg
116;;Nadia Rose Anderson;22.11.18 10:35:24;0;this is awsomeeeeeeeeeeeeeeeeeeee;https://www.youtube.com/watch?v=i5qOzqD9Rms&lc=UgxfPOgiodlWWOjzoOJ4AaABAg
117;;Ndeye Diokhane;22.11.18 10:35:24;0;Gfi bff;https://www.youtube.com/watch?v=i5qOzqD9Rms&lc=UgyFuknVNcUHEVMDzCR4AaABAg
118;;Nelkon Shuaibu;22.11.18 10:35:24;0;I've been waiting for this!;https://www.youtube.com/watch?v=i5qOzqD9Rms&lc=UgyHfOZmE1DDwsa8Hap4AaABAg
119;;Nicole Moore;22.11.18 10:35:24;0;Easter eggs in this trailer!;https://www.youtube.com/watch?v=i5qOzqD9Rms&lc=Ugyuumr-4lGSLYtf9A54AaABAg
120;;Nikhil Kumar;22.11.18 10:35:24;1;Nice g ??????????????????????????????????????????????????????????????????????????????????;https://www.youtube.com/watch?v=i5qOzqD9Rms&lc=UgyEryvZUGJMR-r0Sl14AaABAg
121;;Ninja Hyper;22.11.18 10:35:24;0;I love moms new job;https://www.youtube.com/watch?v=i5qOzqD9Rms&lc=UgwZuxnEoF-Ug_SBghx4AaABAg
122;;Ninja Hyper;22.11.18 10:35:24;0;It is time to make wrong things right;https://www.youtube.com/watch?v=i5qOzqD9Rms&lc=UgzMF55-AQYqlhLyo0x4AaABAg
123;;Old Childhood;22.11.18 10:35:24;0;I love this film, but man it's full of jump scares.;https://www.youtube.com/watch?v=i5qOzqD9Rms&lc=Ugy_wZBHH2KZWYaNMDd4AaABAg
124;;Ovan Nantaa;22.11.18 10:35:24;0;Kapan ada di tv??;https://www.youtube.com/watch?v=i5qOzqD9Rms&lc=Ugy2OVCnRMkPddO3Ddt4AaABAg
